{
    "schema_version": 1,
    "reference_server": "mysql 8.4",
    "about": "How InnoDB performs a DDL operation on MySQL 8.4 — the algorithm it runs under (INSTANT, INPLACE, or COPY), whether it rewrites the whole table, whether it lets other sessions write while it runs, and the lock it holds. The rules read this to classify a migration's downtime_class without a live server. Every entry is a fact stated in our own words with a source link; it is not a copy of the MySQL manual's table. Conditions name the table- or session-level facts a static reader cannot see (a resolver leaves an operation undetermined when one is unknown); explanatory prose lives in notes.",
    "entries": [
        {
            "id": "mysql.column.add_auto_increment",
            "operation": "add_auto_increment_column",
            "algorithm": "inplace",
            "rebuilds_table": true,
            "permits_concurrent_dml": false,
            "lock": "shared",
            "min_version": "8.4",
            "max_version": null,
            "conditions": [],
            "sources": [
                {
                    "url": "https://dev.mysql.com/doc/refman/8.4/en/innodb-online-ddl-operations.html",
                    "anchor": "online-ddl-column-syntax-notes",
                    "retrieved": "2026-07-24"
                }
            ],
            "notes": "Adding a column that carries AUTO_INCREMENT rewrites the whole table in place AND blocks concurrent writes while it runs — the one column addition that is an outage rather than a background cost, because every existing row has to be given a value in order. Preview: the manual states the write-blocking and the rewrite for this case but publishes no table row of its own for it, so the empirical verification against a real server is what will settle the remaining axes.",
            "stability": "preview"
        },
        {
            "id": "mysql.column.add_column",
            "operation": "add_column",
            "algorithm": "instant",
            "rebuilds_table": false,
            "permits_concurrent_dml": true,
            "lock": "none",
            "min_version": "8.4",
            "max_version": null,
            "conditions": [
                {
                    "id": "instant_row_version_limit_reached",
                    "text": "Runs INSTANT only while the table still has room for another row version; after enough instant changes the next one falls back to a rebuild."
                },
                {
                    "id": "row_format_compressed",
                    "text": "Not available on a table using ROW_FORMAT=COMPRESSED, which forces a rebuild instead."
                },
                {
                    "id": "table_has_fulltext_index",
                    "text": "Not available on a table carrying a FULLTEXT index, which forces a rebuild instead."
                }
            ],
            "sources": [
                {
                    "url": "https://dev.mysql.com/doc/refman/8.4/en/innodb-online-ddl-operations.html",
                    "anchor": "online-ddl-column-operations",
                    "retrieved": "2026-07-24"
                }
            ],
            "notes": "Adding a column is metadata-only under INSTANT (the default in 8.4): the table keeps serving reads and writes and is not rewritten. The cheap case that a naive linter would confuse with the expensive ones below. The conditions are the edges a static reader cannot see, so a plain ADD COLUMN is honestly undetermined until they can be confirmed.",
            "stability": "stable"
        },
        {
            "id": "mysql.column.add_stored_generated",
            "operation": "add_stored_generated_column",
            "algorithm": "copy",
            "rebuilds_table": true,
            "permits_concurrent_dml": false,
            "lock": "shared",
            "min_version": "8.4",
            "max_version": null,
            "conditions": [],
            "sources": [
                {
                    "url": "https://dev.mysql.com/doc/refman/8.4/en/innodb-online-ddl-operations.html",
                    "anchor": "online-ddl-generated-column-syntax-notes",
                    "retrieved": "2026-07-24"
                }
            ],
            "notes": "Adding a STORED generated column rewrites the whole table under a COPY, because the value is materialized into every existing row. Concurrent writes are blocked for the duration while reads continue. Its VIRTUAL counterpart is free by comparison — the choice between the two is a downtime decision, not only a storage one.",
            "stability": "stable"
        },
        {
            "id": "mysql.column.add_virtual_generated",
            "operation": "add_virtual_generated_column",
            "algorithm": "instant",
            "rebuilds_table": false,
            "permits_concurrent_dml": true,
            "lock": "none",
            "min_version": "8.4",
            "max_version": null,
            "conditions": [
                {
                    "id": "table_is_partitioned",
                    "text": "The in-place and instant paths apply to a table that is not partitioned; on a partitioned table this operation is classified separately."
                }
            ],
            "sources": [
                {
                    "url": "https://dev.mysql.com/doc/refman/8.4/en/innodb-online-ddl-operations.html",
                    "anchor": "online-ddl-generated-column-syntax-notes",
                    "retrieved": "2026-07-24"
                }
            ],
            "notes": "Adding a VIRTUAL generated column is a definition change only: nothing is materialized into the rows, so no rewrite happens and the table stays available. This is the cheap half of the generated-column choice — the same column declared STORED copies the whole table instead.",
            "stability": "stable"
        },
        {
            "id": "mysql.column.change_character_set",
            "operation": "change_column_character_set",
            "algorithm": "inplace",
            "rebuilds_table": false,
            "permits_concurrent_dml": true,
            "lock": "none",
            "min_version": "8.4",
            "max_version": null,
            "conditions": [
                {
                    "id": "character_set_encoding_unchanged",
                    "text": "In place ONLY when the stored bytes stay valid — measured on 8.4.10: utf8mb3 to utf8mb4 is accepted without a rebuild, while latin1 and ascii to utf8mb4 are refused in place and fall back to COPY."
                },
                {
                    "id": "column_has_index",
                    "text": "Not available for a column covered by an index — measured on 8.4.10: utf8mb3 to utf8mb4 is accepted in place on an unindexed column and refused with error 1846 once a plain KEY covers it. Distinct from the encoding condition above, which refuses latin1 to utf8mb4 even WITHOUT an index; that control was measured in the same run."
                }
            ],
            "sources": [
                {
                    "url": "https://dev.mysql.com/doc/refman/8.4/en/innodb-online-ddl-operations.html",
                    "anchor": "online-ddl-column-operations",
                    "retrieved": "2026-07-26"
                }
            ],
            "notes": "Changing ONE column's character set is markedly cheaper than converting the whole table: measured on 8.4.10, utf8mb3 to utf8mb4 leaves the tablespace id unchanged — no rebuild at all — where CONVERT TO on the same table does rebuild it, because CONVERT TO touches every column. The condition is the same one: a pair that changes the stored encoding is refused in place and becomes a COPY. A column widened this way may also exceed an index prefix limit, which the statement does not show. See also MySQL's chapter on converting between 3-byte and 4-byte Unicode character sets.",
            "stability": "stable"
        },
        {
            "id": "mysql.column.change_collation",
            "operation": "change_column_collation",
            "algorithm": "inplace",
            "rebuilds_table": false,
            "permits_concurrent_dml": true,
            "lock": "none",
            "min_version": "8.4",
            "max_version": null,
            "conditions": [],
            "sources": [
                {
                    "url": "https://dev.mysql.com/doc/refman/8.4/en/innodb-online-ddl-operations.html",
                    "anchor": "online-ddl-column-operations",
                    "retrieved": "2026-07-26"
                }
            ],
            "notes": "Changing a column's collation WITHIN the same character set re-sorts nothing on disk — the bytes are identical, only the comparison rules change. Measured on 8.4.10: tablespace id unchanged, LOCK=NONE accepted. The cost it does carry is invisible here: any index on the column now orders differently, so a query relying on the old ordering silently changes its answer, and a UNIQUE index may start rejecting rows that were distinct under the previous collation.",
            "stability": "stable"
        },
        {
            "id": "mysql.column.change_type",
            "operation": "change_column_type",
            "algorithm": "copy",
            "rebuilds_table": true,
            "permits_concurrent_dml": false,
            "lock": "shared",
            "min_version": "8.4",
            "max_version": null,
            "conditions": [],
            "sources": [
                {
                    "url": "https://dev.mysql.com/doc/refman/8.4/en/innodb-online-ddl-operations.html",
                    "anchor": "online-ddl-column-operations",
                    "retrieved": "2026-07-24"
                }
            ],